{
  "standort": "st-pius",
  "einheiten": "Grundriss-Einheiten; Bildschirm-dp = Einheit × (verfügbare Breite ÷ 971)",
  "viewbox": [
    -10,
    -10,
    971,
    800
  ],
  "boeden": {
    "D": [
      13,
      13,
      314,
      309
    ],
    "B": [
      13,
      328,
      314,
      402
    ],
    "T": [
      746,
      13,
      202,
      274
    ],
    "F": [
      670,
      293,
      278,
      437
    ],
    "FLUR": [
      333,
      328,
      331,
      117
    ]
  },
  "privat": [
    [
      333,
      13,
      188,
      309
    ],
    [
      578,
      451,
      86,
      279
    ],
    {
      "pfad": "M527 13 H740 V287 H664 V322 H527 Z"
    }
  ],
  "waende": [
    "M336 733 H10 V10 H951 V733 H428",
    "M170 10 V248 M170 316 V325",
    "M330 10 V640 M330 712 V733",
    "M524 10 V325",
    "M743 10 V290",
    "M10 325 H210 M282 325 H667",
    "M667 290 H840 M912 290 H951",
    "M667 290 V338 M667 410 V733",
    "M330 448 H355 M427 448 H667",
    "M458 448 V590 M458 662 V733",
    "M575 448 V733"
  ],
  "tueren": [
    {
      "id": "D",
      "angel": [
        282,
        325
      ],
      "offen_bis": [
        282,
        253
      ],
      "winkel_zu": -90
    },
    {
      "id": "T",
      "angel": [
        912,
        290
      ],
      "offen_bis": [
        912,
        218
      ],
      "winkel_zu": -90
    },
    {
      "id": "F",
      "angel": [
        667,
        338
      ],
      "offen_bis": [
        739,
        338
      ],
      "winkel_zu": 90
    },
    {
      "id": "FLUR",
      "angel": [
        355,
        448
      ],
      "offen_bis": [
        355,
        520
      ],
      "winkel_zu": -90
    },
    {
      "id": "B",
      "angel": [
        330,
        640
      ],
      "offen_bis": [
        258,
        640
      ],
      "winkel_zu": -90
    },
    {
      "id": "BAD",
      "angel": [
        458,
        662
      ],
      "offen_bis": [
        386,
        662
      ],
      "winkel_zu": 90
    },
    {
      "id": "D-innen",
      "angel": [
        170,
        316
      ],
      "offen_bis": [
        102,
        316
      ],
      "winkel_zu": null,
      "hinweis": "Tür zwischen den beiden Räumen von Zimmer D, schließt nie"
    }
  ],
  "bad": [
    461,
    451,
    111,
    279
  ],
  "labels": {
    "D": [
      19,
      264
    ],
    "B": [
      22,
      356
    ],
    "T": [
      756,
      40
    ],
    "F": [
      752,
      326
    ]
  },
  "stockbetten": [
    {
      "oben": "D2",
      "unten": "D3",
      "rahmen": [
        86,
        86,
        80,
        160
      ]
    },
    {
      "oben": "D4",
      "unten": "D5",
      "rahmen": [
        176,
        86,
        80,
        160
      ]
    },
    {
      "oben": "B3",
      "unten": "B4",
      "rahmen": [
        244,
        352,
        80,
        170
      ]
    },
    {
      "oben": "T1",
      "unten": "T2",
      "rahmen": [
        750,
        110,
        80,
        170
      ]
    },
    {
      "oben": "F3",
      "unten": "F4",
      "rahmen": [
        864,
        460,
        80,
        170
      ]
    }
  ],
  "plaetze": {
    "D1": [
      16,
      16,
      150,
      62
    ],
    "D6": [
      176,
      16,
      150,
      62
    ],
    "B1": [
      16,
      662,
      150,
      64
    ],
    "B2": [
      16,
      412,
      150,
      64
    ],
    "T3": [
      876,
      16,
      70,
      150
    ],
    "F1": [
      674,
      448,
      150,
      64
    ],
    "F2": [
      674,
      662,
      150,
      64
    ],
    "D2": [
      89,
      89,
      74,
      75.5
    ],
    "D3": [
      89,
      167.5,
      74,
      75.5
    ],
    "D4": [
      179,
      89,
      74,
      75.5
    ],
    "D5": [
      179,
      167.5,
      74,
      75.5
    ],
    "B3": [
      247,
      355,
      74,
      80.5
    ],
    "B4": [
      247,
      438.5,
      74,
      80.5
    ],
    "T1": [
      753,
      113,
      74,
      80.5
    ],
    "T2": [
      753,
      196.5,
      74,
      80.5
    ],
    "F3": [
      867,
      463,
      74,
      80.5
    ],
    "F4": [
      867,
      546.5,
      74,
      80.5
    ]
  },
  "notizen": [
    {
      "text": "PRIVAT",
      "pos": [
        427,
        172
      ]
    },
    {
      "text": "PRIVAT",
      "pos": [
        633,
        172
      ]
    },
    {
      "text": "PRIVAT",
      "pos": [
        621,
        594
      ]
    },
    {
      "text": "FLUR",
      "pos": [
        394,
        566
      ]
    },
    {
      "text": "TREPPE",
      "pos": [
        382,
        775
      ]
    }
  ],
  "rechts_daneben": [
    "L",
    "E",
    "TH",
    "X"
  ],
  "_meta": {
    "schema": "grundriss/1",
    "geaendert_um": "2026-09-01T12:00:00+02:00",
    "geaendert_von": "Leitung",
    "geraet": "tablet-st-pius",
    "version": 3
  }
}
